{
  "name": "package-name",
  "termux_package": true,
  "gui": false,
  "x11_required": false,
  "category": "utilities",
  "short_description": "Short description under 80 characters",
  "long_description": "Longer package description. Markdown is allowed.",
  "install_command": "pkg install package-name",
  "launch_command": "",
  "tips": [],
  "screenshots": [],
  "community_rating": {
    "works_great": 0,
    "unstable": 0,
    "broken": 0
  },
  "submitted_by": "github-username",
  "last_updated": "2026-05-24"
}
